offer_id,o_id,network,maintype,viewtype,off_type,offer_name,incentives,validity,time_duration,recursive,prorated,deposit,sub,unsub,offer_status,info,status,description,offer_cat,charges,details,isms_maincategory_id,pulse,citiesids,compalintids,packagesids,faqs,callsetupfee,prioritytable,workcode,updatenotes,mainheader,notifydomain,offerstatus,sub_medium,unsub_medium
2692,198,Jazz,Offer,CallCenter,2,J All Network Basic/Budget,625 All network minutes,1 Month,24hrs,Yes,Yes,24hrs,*441*32#,-,*1111#,*1111#,A,nan,Postpaid,Rs.873.2 [Excl Tax],"Customer can avail this bundle from our self-service channels i.e.,WhatsApp 03003008000, *446# Dial Code.",2671,-,nan,nan,nan,nan,-,nan,J All Network Budget - Voice - Monthly - Complaints - Wrong/Over Charging J All Network Budget - Voice - Monthly - Complaints - General J All Network Budget - Voice - Monthly - Activation J All Network Budget - Voice - Monthly - Deactivation J All Network Budget - Voice - Monthly - Information J All Network Budget - Voice - Monthly - Complaints - Incentive Issue,nan,B2C,CC - GSM JAZZ,Active,nan,nan
2700,322,Jazz,Offer,CallCenter,19,Weekly Social / Weekly Premium Plus,"10G TikTok, Tamasha, YouTube, Facebook,WhatsApp,IMO, 100 Other Network Min, 1000 Jazz Min & SMS",7 days,-,No,-,-,*660# /*570# / *668# / *117*47#,*660*4# /*668*4#/*117*47*4#,*660*2#/*570*2# /*668*2#/*117*47*2#,*660*3#/*570*3# /*668*3#/*117*47*3#,A,"Weekly Premium/ Weekly Social Plus Offer are no longer available Weekly Premium Plus will be subscribed when customer dials any of the below strings *660# /*570# / *668# / *117*47# This bundle is not available for AJK service class effective from 29th April , 2025",Prepaid,Rs.373 (Incl Tax),"Important Points This is a non-auto recursive offer Overage of Rs. 2.25/MB applies for all mobile internet bundles. Internet offers can be subscribed and consumed in 2G/3G/4G network areas. Bundles will not auto-subscribe and need to be subscribed again upon expiry. Actual internet speed will depend on multiple factors like SIM device, web pages accessed, time of day, number of simultaneous users, distance from 2G/3G/4G site etc. If you are not subscribed to any bundle, base rate will be charged @Rs. 5/ MB Multiple subscription is allowed, incentive will be carry forward and expiry will be as per latest Offer is renamed and available in CSR TB as weekly premium plus Customer can avail this from our self-service channels i.e.,WhatsApp 03003008000.",4516,60 seconds,nan,nan,nan,nan,0,nan,Description Category Area Weekly Premium - Data - Weekly - Activation Prepaid Offers/Bundles Activation Weekly Premium - Data - Weekly - Information Prepaid Offers/Bundles Information Weekly Premium - Data - Weekly - Complaints - Incentive Issue Prepaid Offers/Bundles Complaints - Incentive Issue Weekly Premium - Data - Weekly - Complaints - Wrong/Over Charging Prepaid Offers/Bundles Complaints - Wrong/Over Charging Weekly Premium - Data - Weekly - Complaints - General Prepaid Offers/Bundles Complaints - General,"This bundle is not available for AJK service class effective from 29th April , 2025",B2C,"CC - GSM JAZZ,CC - RTG,CC - CFL,CC - QA,DFS - Helpline,CE Team,CE VMT,RBH,CP,RD,ASM BSM,FRA - ALL,Business centers,EC - Managers,MKT - Segments,MKT-VAS,DIG - ALL,BO - Outsource,BO - In House,CE-Development,Jazz Q&T,CC: Credit & Collection,Social Media,Comm Unit,CX–PTA CORRESPONDENCE TEAM",Active,nan,nan
2724,130,Jazz,Offer,CallCenter,11,Monthly Data Lite,"2GB (1GB for WhatsApp , Facebook and Twitter",30Days,24 hrs,Yes,Yes,24hrs,Backend,CRM,*2222#,nan,A,This is a Private Bolt-On Subscribed to selected customers on a whitelisted Base for customers.,Postpaid,Rs. 150+tax(160),"Please note, Bolt On’s will only be subscribe able from backend and will not be available for subscription on any front end channels.",10011,512 KB,nan,nan,nan,nan,nan,nan,Description Category Area BTL Promo for DATA - Information Marketing Promos/Broadcasts Information,nan,B2C,"CC - GSM JAZZ,CC - CFL,CC - QA",Active,nan,nan
2732,131,Jazz,Offer,CallCenter,15,Twin City Offer(Super SIM Offer),"6GB Data, 600 MIN,600 SMS,30 other Network MIN",7 day,24 hrs,no,no,24hrs,*476#,*476*4#,*476*2#,*476*3#,A,"Offer can only be subscribed within the whitelisted area, however, posted incentives can also be utilized outside the whitelisted area (Nationwide) The offer is available for subscription in Rawalpindi & Islamabad and  Hyderabad and Sukkur & their boundaries Customers with new sims can subscribe to the offer by dialing *476# Customers with new sims can subscribe to the offer multiple times during the first 90 days after the purchase of their sim To check incentive status dial *476*2# This offer is non-recursive Data overage charges of PKR 2.25 /MB (incl. tax) will apply This offer is subject to change at any time",Prepaid,Rs 78,"This is an LBS offer for RWP,ISB, Hyderabad and Sukkur All Prepaid SIM New Sale will have the Parent offer(Twin City Acq) tagged The Twin City Acq offer is FOC and charges will only be deducted in case customer dials subscription string *476# for IRWP,SB, Hyderabad and Sukkur The Offer is only applicable for Normal Prepaid SIM Data SIM, MBB SIM, B2B Prepaid SIM are not eligible for the offer","54,665,149",512 KB,"260,264,575,655",nan,nan,nan,0 paisay,nan,Description Weekly Offer - Hybrid - Weekly (LBC) - Activation Weekly Offer - Hybrid - Weekly (LBC) - Information Weekly Offer - Hybrid - Weekly (LBC) - Complaints - Incentive Issue Weekly Offer - Hybrid - Weekly (LBC) - Complaints - Wrong/Over Charging Weekly Offer - Hybrid - Weekly (LBC) - Complaints - General,offer closed,B2C,"CC - GSM JAZZ,CC - RTG,CC - CFL,CC - QA,DFS - Helpline,CE VMT,Jazz Q&T,MMBL QA,MMBL CC",Expired,nan,nan
2741,307,Jazz,Offer,CallCenter,11,Dedicated Menu for Bronze 2 Customers (*699#),As per respective offer,All offers have 30 days validity,..,Non-Recursive,nan,.,*699# (only accessible by whitelisted base),.N/A,Active,..,A,"We have launched our *699# campaign which is centered around tailored fit solutions for our customers. The campaign mechanisms are as mentioned: *699# string is available for our entire A3M base (90 day active base) including Reactivations & Gross Adds. Tailored fit solutions for every customer. (Based on last month’s usage & Arpu) Customer will be shown 3/4 offers, given their value segments For some value segments, the offers will start from as low as Rs.100 (Balance) The hashtag around this campaign is #merapackagemerisuperpower. The superpower in this particular case is the string as it enables the customers to get personalized offers. These offers can also be subscribed from SIMOSA – available on its recommended section. All remaining customers will be re-directed to NSR menu, from where they can activate bundle from available list All offers are non-recursive and will have to be subscribed again upon expiry Call set-up fee is not applicable in the hybrid/voice bundles Data overage charges of PKR 2.25/MB (incl. tax) will apply in case the incentive gets exhausted however validity is remaining Offers are subject to change anytime Tamasha can be used in Monthly Voice & Facebook Offer Multiple subscriptions are allowed, in case of multiple subscription, incentive will be added and the validity of the latest bundle will apply",Prepaid,As per respective offer available in USSD Menu,"w.e.f. 6th March 2024 11:59 PM , below mentioned changes have been made for bronze customers. Bronze Category Customers have been further divided into below categories Customer will be able to see bronze menu according to the his number’s bronze category (Price points, Status string details are mentioned in the table below) There will be no change in the status string or incentives for the customers who have subscribed to any bronze offer before 6th March 2024 11:59 PM till the expiry of the offer or re-subscription, the change will be effective for new subscriptions. To check status of the subscriptions done after 6th March 2024 11:59 PM, please guide the customer to use the status string mentioned in the subscription notification Products Price(Incl. Tax) Long USSD String Validity Status String Low Value A 1- Mahana 4GB 110 *699*1*1# 30 Days *699*1*2# 2- Mahana 1000 SMS 20 *699*2*1# 30 Days *699*2*2# 3- Mahana 150 All Network Min 110 *699*3*1# 30 Days *699*3*2# 4- Mahana 800 Jazz Min, 1 GB FB & Tamasha 110 *699*4*1# 30 Days *699*4*2# Products Price(Incl. Tax) Long USSD String Validity Status String Low Value B 1- Mahana 5GB 160 *699*1*1# 30 Days *699*5*2# 2- Mahana 1000 SMS 25 *699*2*1# 30 Days *699*6*2# 3- Mahana 200 All Network Min 160 *699*3*1# 30 Days *699*7*2# 4- Monthly Voice & Facebook Offer 160 *699*4*1# 30 Days *699*8*2# Products Price(Incl. Tax) Long USSD String Validity Status String Low Value C 1- Mahana 6GB 200 *699*1*1# 30 Days *699*9*2# 2- Mahana 1000 SMS 30 *699*2*1# 30 Days *699*10*2# 3- Mahana 250 All Network Min 200 *699*3*1# 30 Days *699*11*2# 4- Mahana 1200 Jazz Min, 1 GB FB & Tamasha 200 *699*4*1# 30 Days *699*12*2# Products Price(Incl. Tax) Long USSD String Validity Status String NWD 1 1- Monthly Video & Social Extreme 869 *699*1*1# 30 Days *719*2# 2- Monthly Video & Social 520 *699*2*1# 30 Days *625*2# 3- Monthly GupShup 478 *699*3*1# 30 Days *717*2# Products Price(Incl. Tax) Long USSD String Validity Status String NWD 2 1- Monthly X Plus 2173 *699*1*1# 30 Days *7733*2# 2- Weekly X Plus 608 *699*2*1# 7 Days *7737*2# 3- Monthly Star 1478 *699*3*1# 30 Days *430*2# Products Price(Incl. Tax) Long USSD String Validity Status String NSR 2 1- Monthly Star 1215 *699*1*1# 30 Days *430*2# 2- Weekly Star 434 *699*2*1# 7 Days *508*2# 3- Monthly Video & Social 1215 *699*3*1# 30 Days *625*2# Gross Menu G Offer Name New Menu Name Monthly Super Duper 1: Monthly Super Duper (Rs.868) Monthly Gupshup 2: Monthly Gupshup (Rs.346) Monthly Video & Social Basic <span style",nan,nan,nan,nan,nan,nan,nan,nan,nan,nan,nan,nan,nan,nan,nan
2754,137,Jazz,Offer,CallCenter,15,"Attock, Harripur ad Nowshera Weekly Data Offer","500 On-net Min, 50 Off-net Mins, 10 GB",7 Days,24hrs,No,-,-,*598#,*598*4#,*598*2#,*598*3#,A,"Limited time offer, available only for attached list of locations Weekly Data Offer for Attock, Harripur and Nowshera Jazz Users (rural + urban). No change in behavior and incentive utilization in case of package switching. Usage is allowed nationwide but subscription is allowed in whitelisted sites only.",Prepaid,Rs.304 Incl Tax,"Terms & Conditions Usage is allowed nationwide but subscription is allowed in whitelisted sites only Offer is available to prepaid subscribers in Attock, Harripur and Nowshera. list attached By dialing *598#, customer will be subscribed to the Weekly Data offer, valid for a week This Bundle is non-recursive and customers will have to dial *598# to subscribe to the offer again This is a limited time offer and can be changed any time Offer can be subscribed multiple times, incentive would be added and latest validity would be applicable Call Setup Fee Rs.0",4551,-,nan,nan,nan,nan,No,nan,Attock Haripur LBC Offer - Data - Weekly (LBC) - Activation Attock Haripur LBC Offer - Data - Weekly (LBC) - Information Attock Haripur LBC Offer - Data - Weekly (LBC) - Complaints - Incentive Issue Attock Haripur LBC Offer - Data - Weekly (LBC) - Complaints - Wrong/Over Charging Attock Haripur LBC Offer - Data - Weekly (LBC) - Complaints - General,nan,B2C,"CC - GSM JAZZ,CC - QA,CE Team,CE VMT,FRA - ALL,Business centers,MKT - Segments,BO - Outsource,BO - In House,Jazz Q&T,Social Media,Comm Unit,CX–PTA CORRESPONDENCE TEAM,FSE groups",Active,nan,nan
2760,223,Jazz,Offer,CallCenter,19,Weekly AIO / Weekly All Network(*700#),"5GB, 90 Other Network Min, 1000 Jazz Min & 1000 SMS",X+6,24 hrs,no,no,24hrs,*700#,*700*4#,*700*2#,*700*3#,A,"Customer can avail this from our self-service channels i.e.,WhatsApp 03003008000 Weekly All Network NWD and GT charges are harmonized now.",Prepaid,Rs.347 (Incl Tax),"No Call set-up fee will be charged Upon dialing *700#, customer will be subscribed to weekly all network Offer for X+6 days, offer will expire on midnight of 7th calendar day (including subscription day) All free minutes will be posted at the time of subscription and will expire at 23:59 hrs of 7th calendar day. Multiple subscriptions are allowed Priority of unlimited Haftawar offer is higher than legacy minutes Customer can avail this bundle from our self-service channels i.e.,WhatsApp 03003008000, 3111 Self-Service IVR.",2843,512 KB,nan,nan,nan,Test FAQ added,0 paisay,nan,"Weekly All Network Offer - Hybrid - Weekly - Activation In case customer request to activate Weekly All Network Offer Weekly All Network Offer - Hybrid - Weekly - Information In case customer inquire product information (price,validity,incentive,procedure,etc) for Weekly All Network Offer Weekly All Network Offer - Hybrid - Weekly - Complaints - Incentive Issue In case customer complaint for issues related to incentive (early expiry,early data blocking,less incentive posted, incentive utilization, etc) for Weekly All Network Offer Weekly All Network Offer - Hybrid - Weekly - Complaints - Wrong/Over Charging In case customer complaint for issues related to charging (double deduction, wrong bundle price charged,etc) for Weekly All Network Offer Weekly All Network Offer - Hybrid - Weekly - Complaints - General In case customer complaint for error on activating offer or any other issue other than incentive,wrong/over charging for Weekly All Network Offer",3G speed removed,B2C,"CC - GSM JAZZ,Social Media,Comm Unit",Active,nan,nan
2771,144,Jazz,Offer,CallCenter,19,Quetta Haftawar Offer (LBS),"12GB, 5000 on-net, 100 off-net , sms 5000",7 days,-,No,No,-,*609#,*609*4#,*609*2#,*609*3#,A,Posted incentive after successful subscription under whitelisted area can be consumed nationwide Offer is only for selected areas (LBS model) Call setup is 0 Overage is applicable Rs.2.25/mb Multiple subscription is allowed Upon multiple subscriptions incentive will add up and validity will be as per latest subscription,Prepaid,Rs.304 [Incl Tax],nan,5207,60 seconds,nan,nan,nan,nan,0,nan,"Description Category Area Haftawar Offer - Data,Voice - Weekly (LBC) - Activation Prepaid Offers/Bundles Activation Haftawar Offer - Data,Voice - Weekly (LBC) - Information Prepaid Offers/Bundles Information Haftawar Offer - Data,Voice - Weekly (LBC) - Complaints - Incentive Issue Prepaid Offers/Bundles Complaints - Incentive Issue Haftawar Offer - Data,Voice - Weekly (LBC) - Complaints - Wrong/Over Charging Prepaid Offers/Bundles Complaints - Wrong/Over Charging Haftawar Offer - Data,Voice - Weekly (LBC) - Complaints - General Prepaid Offers/Bundles Complaints - General",isms added,B2C,"CC - GSM JAZZ,CC - RTG,CC - CFL,CC - QA,DFS - Helpline,CE Team,CE VMT,Business centers,EC - Managers,MKT - Segments,DIG - ALL,BO - Outsource,BO - In House,Jazz Q&T,CC: Credit & Collection,Social Media,Comm Unit,FSE groups,MMBL QA,MMBL CC,JAZZ WORLD TEAM",Active,nan,nan
2775,145,Jazz,Offer,CallCenter,18,Jazz 2000 Add-On (Jazz 2000 SMS Add-On) - *441*25#,2000 All Net SMS,30 Days,-,No,No,24 Hrs,CRM + USSD / WhatsApp,-,-,-,A,"Customer can avail this from our self-service channels i.e.,WhatsApp 03003008000",Postpaid,Rs.72.77 [Excl Tax],nan,4136,-,nan,nan,nan,nan,-,nan,2000 SMS Add On - SMS - Monthly - Complaints - Wrong/Over Charging 2000 SMS Add On - SMS - Monthly - Complaints - General 2000 SMS Add On - SMS - Monthly - Activation 2000 SMS Add On - SMS - Monthly - Information 2000 SMS Add On - SMS - Monthly - Complaints - Incentive Issue,nan,B2C,"CC - GSM JAZZ,CC - CFL,CC - QA,CE Team,CE VMT,ASM BSM,FRA - ALL,Business centers,MKT - Segments,BO - Outsource,BO - In House,Jazz Q&T,CC: Credit & Collection,Social Media,Comm Unit,CX–PTA CORRESPONDENCE TEAM,FSE groups",Active,nan,nan
2779,146,Jazz,Offer,CallCenter,11,CVM Weekly All Network(*730#),"3GB Data, 1000 Onnet MIN,60Offnet MIN, 1000 SMS",X+6 Days,24 hrs,no,no,24hrs,*730#,*730*4#,*730*2#,*730*3#,A,Discounted Version of Weekly All Network Offer.,Prepaid,Rs. 150,nan,nan,512 KB,725,nan,nan,nan,0 paisay,nan,Description Category Area Weekly All Network Offer - Hybrid - Weekly - Activation Prepaid Offers/Bundles Activation Weekly All Network Offer - Hybrid - Weekly - Information Prepaid Offers/Bundles Information Weekly All Network Offer - Hybrid - Weekly - Complaints - Incentive Issue Prepaid Offers/Bundles Complaints - Incentive Issue Weekly All Network Offer - Hybrid - Weekly - Complaints - Wrong/Over Charging Prepaid Offers/Bundles Complaints - Wrong/Over Charging Weekly All Network Offer - Hybrid - Weekly - Complaints - General Prepaid Offers/Bundles Complaints - General,WCs are updated,B2C,"CC - GSM JAZZ,CC - RTG,CC - CFL,CC - QA,CE VMT,Business centers,EC - Managers,BO - Outsource,BO - In House,CE-Development,Social Media,Comm Unit,FSE groups,JAZZ WORLD TEAM,Helpdesk_CallCenter,Helpdesk_BackEndTeam,Helpdesk_ExperienceCenter,Helpdesk_Franchise",Active,nan,nan
2791,157,Jazz,Offer,CallCenter,11,CVM Offers,-,-,-,-,-,-,-,-,-,-,A,CVM offers are available for targetted customer base. CVM team identify a certain base of customer and whitelist them for a certain offer. Customer is informed about the elgibility of these offers via Bulk SMS notifications. Customer who received the SMS is eligible for that offer only. Currently CVM team is pitching 13 offers to certain whitelisted prepaid customers for which table is shared in Offer Details Tab below.,Prepaid,-,"Product Name USSD Code Status String Unsubscription_Code Price After Tax On-Net Min Off-Net Min SMS Data Validity (Days) SMS Notification Jazz CVM Weekly 4G 2GB Trial Bundle *612# - Non recursive offer. Will be unsubscribed after validity ends 0 - - - 2000 7 Currently not being pushed in any campaign Jazz CVM Daily 1GB Free Bundle *712# - Non recursive offer. Will be unsubscribed after validity ends 0 - - - 1000 2 MUFT 1GB 4G Internet! Aaj 70 Rupay ka Recharge keren aur kal hi paien 1 din k liye 1000MB MUFT JAZZ Super 4G Internet! 5GB CVM 4G Only Trial Bundle (Weekly) *674# *671*2# Non recursive offer. Will be unsubscribed after validity ends 0 - - - 5000 4G Only 7 Pura Hafta MUFT 4G istemaal karain! Apko 7 din k liye 5 GB MUFT Jazz Super 4G de diye gaey hein. In 5 GB se ap sirf 4G internet istemaal kr saktay hain. 5GB CVM 4G Only Trial Bundle (3 Day) *675# *676*2# Non recursive offer. Will be unsubscribed after validity ends 0 - - - 3GB + 2GB FB & WA + 100MBs (2G/3G) 3 MUFT 4G istemaal karain! Apko 3 din k liye 5 GB (2GB Facebook+WhatsApp) MUFT Jazz Super 4G de diye gaey hein. T&Cs apply. For status dial *676*2# CVM Free Recursive Voice offer - Parent *912# *914*2# Non recursive offer. Will be unsubscribed after validity ends 0 10 (Daily) - - - 3 10 MINS FREE! Muaziz Sarif, Apko 3 din k liye rozana 10 MUFT Jazz MINS de diye gaey hein. Call setup lagoo hein! Status check karne k liye *914*2# milain! CVM Free Recursive Voice offer  (with Call Setup) *912# *914*2# Non recursive offer. Will be unsubscribed after validity ends 0 15 - - - 1 15 MUFT MINS! JAZZ se apko MUFT 15 JAZZ min milay hain takay ap apne piyaron say rabtay may rehain, is offer ki mudat kl raat 12 baje tak! CVM Rs.1 Recursive Voice Offer (1 Day recurrsive) *916# *918*2# *918*4# 2 50 - - - 1 Aj *916# milain aur rozana Rs. 2 me 50 Jazz minutes ek din k liye payein! Offer khatam karne k liye *918*4# milain! Recursive CVM Hybrid Bundle (1 Day recurrsive) *932# *933*2# *932*4# 1 10 - 10 200 Mb 1 Aj *932# milain aur rozana Rs. 1 me 10 Jazz mins, 10 SMS aur 200 MBs ek din k liye payein! Offer khatam karne k liye *932*4# milain! Recursive CVM Hybrid Bundle RS4 (1 Day recurssive) *940# *940*2# *940*4# 4 30 - 30 500 Mb 1 Abhi *940# Dial Kren, aur hasil kren 30 On-Net Mins, 30 SMS aur 500 MBs puray 24 Ghantay kay liye rozana sirf Rs.4 Main. Offer khatm ke lie *940*4# milain CVM 4G Bundle Rs 1 *243# - Non recursive offer. Will be unsubscribed after validity ends 1 - - - 5120 4G Only 3 Zabardast 4G Offer! Abhi *243# dial karein aur hasil karein 5GB JAZZ SUPER 4G for 3 days in just Rs. 1 (Incl. tax)! CVM 4G Bundle Rs 5 *244# *244*2# Non recursive offer. Will be unsubscribed after validity ends 5 - - - 5120 4G Only 3 Zabardast 4G Offer! Abhi *244# dial karein aur hasil karein 5GB JAZZ SUPER 4G for 3 days in just Rs. 5 (Incl. tax)! CVM 4G Bundle Rs 15 *245# *245*2# Non recursive offer. Will be unsubscribed after validity ends 15 - - - 5120 4G Only 3 Zabardast 4G Offer! Abhi *245# dial karein aur hasil karein 5GB JAZZ SUPER 4G for 3 days in just Rs. 15 (Incl. tax)! Weekly Off Peak Bundle *690# *691*2# Non recursive offer. Will be unsubscribed after validity ends 0 - - - 5120 MB (Excl. 7PM-9PM) 7 FREE 5000MB! Aap ko 7 din k liye 5000MB MUFT de diye gaye hein (Excl. 7PM - 9PM). Toh abhi JAZZ Super 4G enjoy keren! Status check karne k liye dial *691*2#","5,083,523,852,397,520",-,nan,nan,nan,Please note above offers are available only for limited customers We will not take any complaints regarding sub/unsub of these offers and guide customers upfront as per offer details Jazz lite service is not allowed on CVMVOICE24HRS offer The peak hours for these incentives are between 7 PM and 11 PM.,-,nan,CVM Weekly 4G Trial Bundle - Data - Weekly - Activation CVM Daily 1GB Free Bundle - Data - Daily - Activation 5GB CVM 4G Only Trial Bundle (Weekly) - Data - Weekly - Activation 5GB CVM 4G Only Trial Bundle (3 Day) - Data - 3 Day - Activation CVM Weekly 4G Trial Bundle - Data - Weekly - Information CVM Daily 1GB Free Bundle - Data - Daily - Information 5GB CVM 4G Only Trial Bundle (Weekly) - Data - Weekly - Information 5GB CVM 4G Only Trial Bundle (3 Day) - Data - 3 Day - Information CVM Weekly 4G Trial Bundle - Data - Weekly - Complaints - Incentive Issue CVM Daily 1GB Free Bundle - Data - Daily - Complaints - Incentive Issue 5GB CVM 4G Only Trial Bundle (Weekly) - Data - Weekly - Complaints - Incentive Issue 5GB CVM 4G Only Trial Bundle (3 Day) - Data - 3 Day - Complaints - Incentive Issue CVM Weekly 4G Trial Bundle - Data - Weekly - Complaints - Wrong/Over Charging CVM Daily 1GB Free Bundle - Data - Daily - Complaints - Wrong/Over Charging 5GB CVM 4G Only Trial Bundle (Weekly) - Data - Weekly - Complaints - Wrong/Over Charging 5GB CVM 4G Only Trial Bundle (3 Day) - Data - 3 Day - Complaints - Wrong/Over Charging CVM Weekly 4G Trial Bundle - Data - Weekly - Complaints - General CVM Daily 1GB Free Bundle - Data - Daily - Complaints - General 5GB CVM 4G Only Trial Bundle (Weekly) - Data - Weekly - Complaints - General 5GB CVM 4G Only Trial Bundle (3 Day) - Data - 3 Day - Complaints - General,nan,B2C,"CC - GSM JAZZ,CC - CFL,CC - QA,CE Team,CE VMT,CP,FRA - ALL,Business centers,EC - Managers,BO - Outsource,BO - In House,Jazz Q&T,Social Media,Comm Unit,CX–PTA CORRESPONDENCE TEAM,FSE groups,JAZZ WORLD TEAM",Active,nan,nan
2803,160,Jazz,Offer,CallCenter,19,15 Day AIO,"2500 On-net, 250 Off-net, 2500 SMS, 10 GB Data",X+14 days,24 Hours,No,-,24 Hours,*515#,*515*4#,*515*2#,*515*3#,A,15 Day AIO Offer is available for subscription via whatsapp as well. Please guide customer accordingly.,Prepaid,Rs.695 [Incl Tax],Multiple subscriptions: Allowed,"53,385,339",-,nan,nan,nan,nan,0,nan,15794 Prepaid Offers/Bundles All in One 15 Day - Hybrid - Bi Monthly - Activation 15795 Prepaid Offers/Bundles All in One 15 Day - Hybrid - Bi Monthly - Information 15796 Prepaid Offers/Bundles All in One 15 Day - Hybrid - Bi Monthly - Complaints - Incentive Issue 15797 Prepaid Offers/Bundles All in One 15 Day - Hybrid - Bi Monthly - Complaints - Wrong/Over Charging 15798 Prepaid Offers/Bundles All in One 15 Day - Hybrid - Bi Monthly - Complaints - General,price up,B2C,"CC - GSM JAZZ,CC - RTG,CC - CFL,CC - QA,DFS - Helpline,CE Team,CE VMT,RBH,CP,RD,ASM BSM,FRA - ALL,Business centers,EC - Managers,MKT - Segments,MKT-VAS,DIG - ALL,BO - Outsource,BO - In House,CE-Development,Jazz Q&T,CC: Credit & Collection,Social Media,Comm Unit,CX–PTA CORRESPONDENCE TEAM,FSE groups,MMBL QA,Regional Finance Business Partner,MMBL CC,JAZZ WORLD TEAM,Sales,B2B,Sales (Regional commercial),Sales Operation Executive,BIZ,DFS Customer Experience Team",Active,nan,nan
2807,323,Jazz,Offer,CallCenter,19,Monthly YouTube and Social (Infinity Social),"10 GB (YT, FB, WA, IMO), 50 Off-net min, 300 Jazz min",X + 29 Days,24 Hours,-,-,24 Hours,*620#,*620*4#,*620*2#,*620*3#,A,Offer is available for subscription via whatsapp as well. Please guide customer accordingly.,Prepaid,Rs.521 [Incl Tax],"Infinity Social: Subscription Channels: USSD (*620#) Social Data Incentive: 10 GB (YT, FB, WA, IMO), 50 Off-net min, 300 Jazz min Call setup Fee: Rs. 0 Overage: Rs. 2.25/Mb Multiple subscription: Allowed",5361,-,nan,nan,nan,nan,0,nan,15799 Prepaid Offers/Bundles Infinity Social - Hybrid - 3 Month - Activation 15800 Prepaid Offers/Bundles Infinity Social - Hybrid - 3 Month - Information 15801 Prepaid Offers/Bundles Infinity Social - Hybrid - 3 Month - Complaints - Incentive Issue 15802 Prepaid Offers/Bundles Infinity Social - Hybrid - 3 Month - Complaints - Wrong/Over Charging 15803 Prepaid Offers/Bundles Infinity Social - Hybrid - 3 Month - Complaints – General,price up,B2C,"CC - GSM JAZZ,CC - RTG,CC - CFL,CC - QA,DFS - Helpline,CE Team,CE VMT,RBH,CP,RD,ASM BSM,FRA - ALL,Business centers,EC - Managers,MKT - Segments,MKT-VAS,DIG - ALL,BO - Outsource,BO - In House,CE-Development,Jazz Q&T,CC: Credit & Collection,Social Media,Comm Unit,CX–PTA CORRESPONDENCE TEAM,FSE groups,MMBL QA,Regional Finance Business Partner,MMBL CC,JAZZ WORLD TEAM,Sales,B2B,Sales (Regional commercial),Sales Operation Executive,BIZ,DFS Customer Experience Team",Active,nan,nan
