offer_id,o_id,network,maintype,viewtype,off_type,offer_name,incentives,validity,time_duration,recursive,prorated,deposit,sub,unsub,offer_status,info,status,description,offer_cat,charges,details,isms_maincategory_id,pulse,citiesids,compalintids,packagesids,faqs,callsetupfee,prioritytable,workcode,updatenotes,mainheader,notifydomain,offerstatus,sub_medium,unsub_medium
18,4,Jazz,IDD,CallCenter,28,IDD Group 1 (5 Destinations),Reduced rates,30 Days,24 Hours,Yes,Yes,24 Hours,"Customer Care Center, Contact Centers and Franchise Centers","Customer Care Center, Contact Centers and Franchise Centers",Live,Dest-100 m-Initial -- PKR 100 m100 -- PKR 100 m400 -- PKR 100 m600 -- PKR 100 m900 -- PKR 100 5-Intl. Dest-50 m300 -- PKR 50 m999 -- PKR 50 m1500 -- PKR 50 mUnlimited (Basic+Premium) -- PKR 50 Business Package -- PKR 50,A,IDD Destinations (per 60 sec): USA (L+M): PKR 0.89 Canada (L+M): PKR 0.89 Australia (L): PKR 1.39 China (L+M): PKR 1.39 Singapore (L+M): PKR 1.39 Tariff Name | Applicable Package | Recurring Charges 5-Intl. Dest-100 m-Initial -- PKR 100 m100 -- PKR 100 m400 -- PKR 100 m600 -- PKR 100 m900 -- PKR 100 5-Intl. Dest-50 m300 -- PKR 50 m999 -- PKR 50 m1500 -- PKR 50 mUnlimited (Basic+Premium) -- PKR 50 Business Package -- PKR 50,Postpaid,Dest-100 m-Initial -- PKR 100 m100 -- PKR 100 m400 -- PKR 100 m600 -- PKR 100 m900 -- PKR 100 5-Intl. Dest-50 m300 -- PKR 50 m999 -- PKR 50 m1500 -- PKR 50 mUnlimited (Basic+Premium) -- PKR 50 Business Package -- PKR 50,Tariff Name | Applicable Package | Recurring Charges 5-Intl. Dest-100 m-Initial -- PKR 100 m100 -- PKR 100 m400 -- PKR 100 m600 -- PKR 100 m900 -- PKR 100 5-Intl. Dest-50 m300 -- PKR 50 m999 -- PKR 50 m1500 -- PKR 50 mUnlimited (Basic+Premium) -- PKR 50 Business Package -- PKR 50 IDD Destinations (per 60 sec): USA (L+M): PKR 0.89 Canada (L+M): PKR 0.89 Australia (L): PKR 1.39 China (L+M): PKR 1.39 Singapore (L+M): PKR 1.39,"10,311,032",60 seconds,nan,nan,nan,"The Products can be activated from Customer Care Center, Contact Centers and Franchise Centers. Both the products can be opted for simultaneously. Charges will be prorated based on the dates of subscription. The product will be on auto subscription after the first month. Charges for the product may vary depending on the customer’s package as mentioned above. The products will not be given to customers who do not have ISD, they will have to get the ISD activated as per the existing process. M-Initial to M-900 packages can avail IDD Group1- 100 & IDD Group2- 100 offers only. M-1500 to M-unlimited (Basic+Premium) can avail IDD Group1- 50 & IDD Group2 - 50 offers only. Business subscribers can contact their CAMs to subscribe this service. The prices shown above are exclusive of taxes",nan,nan,IDD Group 1 - 50 - Voice - Monthly - Information IDD Group 1 - 100 - Voice - Monthly - Information IDD Group 2 - 50 - Voice - Monthly - Information IDD Group 2 - 100 - Voice - Monthly - Information IDD Group 1 - 50 - Voice - Monthly - Complaints - Wrong/Over Charging IDD Group 1 - 100 - Voice - Monthly - Complaints - Wrong/Over Charging IDD Group 2 - 50 - Voice - Monthly - Complaints - Wrong/Over Charging IDD Group 2 - 100 - Voice - Monthly - Complaints - Wrong/Over Charging IDD Group 1 - 50 - Voice - Monthly - Activation IDD Group 1 - 100 - Voice - Monthly - Activation IDD Group 2 - 50 - Voice - Monthly - Activation IDD Group 2 - 100 - Voice - Monthly - Activation IDD Group 1 - 50 - Voice - Monthly - Deactivation IDD Group 1 - 100 - Voice - Monthly - Deactivation IDD Group 2 - 50 - Voice - Monthly - Deactivation IDD Group 2 - 100 - Voice - Monthly - Deactivation,nan,B2C,CC - GSM JAZZ,Active,nan,nan
29,102,Jazz,Offer,CallCenter,19,Chenab Haftawar Offer (Old Name Chiniot LBC),"4GB, 20 Off-Net, 200 On-Net Min aur 200 SMS",7 days,24 hours,No,No,24 hours,*664#,*664*4#,*664*2#,*664*3#,A,"effective from 14th december, revised incentive will be 4GB, 20 Off-Net, 200 On-Net Min aur 200 SMS Jazz is pleased to announce a new Location Based Weekly Hybrid Offer for our valued customers in Chiniot Usage is allowed nationwide but subscription is allowed in whitelisted sites only.",Prepaid,Rs. 173 (inc tax),"Terms and Conditions: Usage is allowed nationwide but subscription is allowed in whitelisted sites only. Upon dialing *664#, customer will be subscribed to Super Chenab Offer for 7 days Free Minutes/ SMS/ Data will be usable 24 hours a day (no time limit) Bundle is non-recursive and multiple subscriptions are allowed Customer will be charged as per respective base rate package incase bundle incentives have exhausted and customer is not subscribed to any other bundle. Limited time offer, it is subject to change anytime",4646,60 Sec,nan,nan,nan,nan,0,nan,Description Category Area Super Chenab Offer - Hybrid - Weekly (LBC) - Activation Prepaid Offers/Bundles Activation Super Chenab Offer - Hybrid - Weekly (LBC) - Information Prepaid Offers/Bundles Information Super Chenab Offer - Hybrid - Weekly (LBC) - Complaints - Incentive Issue Prepaid Offers/Bundles Complaints - Incentive Issue Super Chenab Offer - Hybrid - Weekly (LBC) - Complaints - Wrong/Over Charging Prepaid Offers/Bundles Complaints - Wrong/Over Charging Super Chenab Offer - Hybrid - Weekly (LBC) - Complaints - General Prepaid Offers/Bundles Complaints - General,"effective from 14th december, revised incentive will be 4GB, 20 Off-Net, 200 On-Net Min aur 200 SMS",B2C,"CC - GSM JAZZ,FRA - ALL,FSE groups",Active,nan,nan
30,102,Jazz,Offer,CallCenter,19,Chenab Haftawar Offer (Old Name Chiniot LBC),"4GB, 20 Off-Net, 200 On-Net Min aur 200 SMS",7 days,24 hours,No,No,24 hours,*664#,*664*4#,*664*2#,*664*3#,A,"effective from 14th december, revised incentive will be 4GB, 20 Off-Net, 200 On-Net Min aur 200 SMS Jazz is pleased to announce a new Location Based Weekly Hybrid Offer for our valued customers in Chiniot Usage is allowed nationwide but subscription is allowed in whitelisted sites only.",Prepaid,Rs. 173 (inc tax),"Terms and Conditions: Usage is allowed nationwide but subscription is allowed in whitelisted sites only. Upon dialing *664#, customer will be subscribed to Super Chenab Offer for 7 days Free Minutes/ SMS/ Data will be usable 24 hours a day (no time limit) Bundle is non-recursive and multiple subscriptions are allowed Customer will be charged as per respective base rate package incase bundle incentives have exhausted and customer is not subscribed to any other bundle. Limited time offer, it is subject to change anytime",4646,60 Sec,nan,nan,nan,nan,0,nan,Description Category Area Super Chenab Offer - Hybrid - Weekly (LBC) - Activation Prepaid Offers/Bundles Activation Super Chenab Offer - Hybrid - Weekly (LBC) - Information Prepaid Offers/Bundles Information Super Chenab Offer - Hybrid - Weekly (LBC) - Complaints - Incentive Issue Prepaid Offers/Bundles Complaints - Incentive Issue Super Chenab Offer - Hybrid - Weekly (LBC) - Complaints - Wrong/Over Charging Prepaid Offers/Bundles Complaints - Wrong/Over Charging Super Chenab Offer - Hybrid - Weekly (LBC) - Complaints - General Prepaid Offers/Bundles Complaints - General,nan,B2C,"CC - GSM JAZZ,FRA - ALL,FSE groups",Active,nan,nan
35,113,Jazz,Offer,CallCenter,19,Monthly Super Max/Monthly Max,"On-net Minute 3000, Off-net Minutes 500; SMS 3000 ; 50 GBs Data",X+29 Days,24 hours,No,No,24 hours,*708#,*708*4#,*708*2#,*708*3#,A,"Effective 22nd Jan, 2025 11:59 PM, the bundle is whitelisted for resource carry forward Package not available for AJK/GB region effective from 6th September, 2024 •    This Offer is non-recursive and customers will have to dial *708# again to avail the offer more than once Offer is available for subscription via whatsapp as well. Please guide customer accordingly.",Prepaid,Rs.1913 (Incl Tax),"Important Points All free minutes will be posted at the time of subscription and will expire at 23:59 hours of the 30th calendar day Overage of Rs. 2.25/MB applies in the event bundle incentives have been exhausted If you are not subscribed to any bundle, base rate will be charged i-e Rs. 5/MB. Charging pulse will be 512 KB Call Setup charges are not applicable for this bundle. Multiple subscriptions are allowed, expiry will be as per latest sub Launch of Upward Resource | Rollover Feature This is to update all that we are introducing a new feature to encourage upward migration of prepaid offers. Through this feature, if a person upgrades to a higher priced prepaid bundle, their incentives from current bundle will be carried forward / rolled over /clubbed into the new subscribed bundle. Example: If a customer is having Monthly Max (Rs.1652) bundle subscribed with certain incentives/expiry remaining and opted for Monthly Freedom (Rs.1739) bundle, all remaining incentives of the Monthly Max will be carried forward / rolled over / clubbed into Monthly Freedom with updated expiry. Monthly Max Offer/DA’s will be removed from Consumption tab in CSRtb. Incentives Category Current/Existing/Already Subscribed Bundle New Subscribed Bundle CSRtb Consumption Tab Visibility Monthly Max (Remaining Incentives at the time of High Price Bundle Subscription) Monthly Freedom (Incentives given at the time of new subscription/default incentives) - Monthly Freedom will be visible - Monthly Max will not be visible On-Net Minutes 100 3000 3100 Off-Net Minutes 50 750 800 SMS 25 3000 3025 Data 1GB 100GB 101GB Monthly Freedom Offer will be visible in CSRtb Consumption Tab with updated incentives and default expiry. Monthly Max Offer will be removed from Consumption Tab. MEMO of Monthly Max deletion will be visible in MEMOs Tab along with MEMO of Monthly Freedom subscription having same timestamp. Remaining incentives of Monthly Max can be checked from Usage Tab under column “Balance / Remaining Incentive” (if needed to handle complaint) Matrix: Monthly Max (Low Price Bundle) --------> Monthly Freedom (High Price Bundle)  (Resource Roll Over Allowed) Monthly Freedom (Low Price Bundle) --------> Monthly X (High Price Bundle)  (Resource Roll Over Allowed) Monthly Max (Low Price Bundle) --------> Monthly X (High Price Bundle)  (Resource Roll Over Allowed) Monthly Freedom (High Price Bundle) --------> Monthly Max (Low Price Bundle)  (Resource Roll Over Not Allowed, incentives will be tagged separately as per existing behavior) Monthly X (High Price Bundle) --------> Monthly Freedom (Low Price Bundle)  (Resource Roll Over Not Allowed, incentives will be tagged separately as per existing behavior) Monthly X (High Price Bundle) --------> Monthly Max (Low Price Bundle)  (Resource Roll Over Not Allowed, incentives will be tagged separately as per existing behavior)",4754,60 Sec,nan,nan,nan,nan,0,nan,Description Category Area Monthly Max - Hybrid - Monthly - Activation Prepaid Offers/Bundles Activation Monthly Max - Hybrid - Monthly - Information Prepaid Offers/Bundles Information Monthly Max - Hybrid - Monthly - Complaints - Incentive Issue Prepaid Offers/Bundles Complaints - Incentive Issue Monthly Max - Hybrid - Monthly - Complaints - Wrong/Over Charging Prepaid Offers/Bundles Complaints - Wrong/Over Charging Monthly Max - Hybrid - Monthly - Complaints - General Prepaid Offers/Bundles Complaints - General,Price updated from 27-5-25,B2C,"CC - GSM JAZZ,FRA - ALL,FSE groups",Active,nan,nan
59,11,Jazz,Offer,CallCenter,2,Daily Voice Bundle - Whitelisted,100 Jazz/Warid minutes,Same day midnight (12AM),24 hours,No,No,Same day midnight (12AM),nan,nan,*673*2#,nan,A,Pilot Launch: The offer is currently launched for 100K voice dormant users as a pilot for next 2 weeks (ending 22nd November). Detailed update will be released once we launch the offer commercially. •    Eligibility: Voice users who didn’t use voice calls in last calendar month,Prepaid,Rs.4 inclusive of tax,"To encourage our customers to keep using Jazz as their preferred network for voice calls, we have launched a whitelisted offer for our voice dormant users. The whitelisted Daily Voice Bundle will offer 100 Jazz Warid minutes for Rs.4 inclusive of tax valid till 12AM midnight. Pilot Launch: The offer is currently launched for 100K voice dormant users as a pilot for next 2 weeks (ending 22nd November). Detailed update will be released once we launch the offer commercially. •    Eligibility: Voice users who didn’t use voice calls in last calendar month",nan,60 Sec,nan,nan,nan,nan,0.15,nan,Description Category Area Whitelisted Daily Voice Offer - Voice - Daily - Activation Prepaid Offers/Bundles Activation Whitelisted Daily Voice Offer - Voice - Daily - Information Prepaid Offers/Bundles Information Whitelisted Daily Voice Offer - Voice - Daily - Complaints - Incentive Issue Prepaid Offers/Bundles Complaints - Incentive Issue Whitelisted Daily Voice Offer - Voice - Daily - Complaints - Wrong/Over Charging Prepaid Offers/Bundles Complaints - Wrong/Over Charging Whitelisted Daily Voice Offer - Voice - Daily - Complaints - General Prepaid Offers/Bundles Complaints - General,WCs are updated,B2C,"FRA - ALL,FSE groups",Active,nan,nan
64,192,Jazz,Offer,CallCenter,15,Sargodha Haftawar LBC offer (*627#),"3000 MBs , 3000 Onnet, 30 Offnet, 3000 SMS",X+6 days,24 hours,No,No,24 hours,*627#,*627*4#,*627*2#,*627*3#,A,"•    Offer is available for Jazz and Warid prepaid subscribers residing in the following cities of Sargodha and Bhalwal and their surrounding areas •   Subscription can only be done from whitelisted areas while usage is allowed nationwide •    Upon dialing *627#, customer will be subscribed to Sargodha Haftawar Offer LBC offer for 7 days •    All incentives will be posted at the time of subscription and will expire at 23:59 hours of the 7th day from activation •    Bundle is non-recursive and multiple subscriptions are allowed •    Limited time offer, it is subject to change anytime •    Currently this offer has priority, so any offer activated along with this offer may be consumed first",Prepaid,Rs.173 (incl tax),nan,4718,60 Sec,"62,611",nan,nan,nan,0,nan,Sargodha Weekly Hybrid - Hybrid - Weekly (LBC) - Activation Sargodha Weekly Hybrid - Hybrid - Weekly (LBC) - Information Sargodha Weekly Hybrid - Hybrid - Weekly (LBC) - Complaints - Incentive Issue Sargodha Weekly Hybrid - Hybrid - Weekly (LBC) - Complaints - Wrong/Over Charging Sargodha Weekly Hybrid - Hybrid - Weekly (LBC) - Complaints - General,nan,B2C,"CC - GSM JAZZ,CC - QA,CE Team,CE VMT,BO - Outsource,BO - In House,Social Media,Comm Unit",Active,nan,nan
72,288,Jazz,Offer,CallCenter,15,Lajawab Haftawar Offer,"2GB, 2000 On-Net Min, 30 Off-Net Min",7 days,24 hours,No,No,24 Hours,*565#,*565*4#,*565*2#,*565*3#,A,"Offer can only be subscribed within the whitelisted area, however, posted incentives can also be utilized outside the whitelisted area (Nationwide)",Prepaid,Rs.173 (incl tax),"Terms & Condition Offer is available for prepaid subscribers in Mandi Bahauddin, Malakwal, Phalia, Dera Ghazi Khan, Jampur, Rajanpur, Dajal, Rojhan, Taunsa and Jhang Upon dialing *565#, customer will be subscribed to the Lajawab Haftawar Offer Bundle is non-recursive and multiple subscriptions are allowed Customer will be charged as per respective base rate package in case bundle incentives have exhausted and customer is not subscribed to any other bundle. This is limited time offer, subject to change anytime",nan,60 Sec,nan,nan,nan,nan,0,nan,Description Weekly Mandi Bahaudin - Hybrid - Weekly (LBC) - Activation Weekly Mandi Bahaudin - Hybrid - Weekly (LBC) - Information Weekly Mandi Bahaudin - Hybrid - Weekly (LBC) - Complaints - Incentive Issue Weekly Mandi Bahaudin - Hybrid - Weekly (LBC) - Complaints - Wrong/Over Charging Weekly Mandi Bahaudin - Hybrid - Weekly (LBC) - Complaints - General,incentive of the offer changed,B2C,CC - GSM JAZZ,Active,nan,nan
