offer_id,o_id,network,maintype,viewtype,off_type,offer_name,incentives,validity,time_duration,recursive,prorated,deposit,sub,unsub,offer_status,info,status,description,offer_cat,charges,details,isms_maincategory_id,pulse,citiesids,compalintids,packagesids,faqs,callsetupfee,prioritytable,workcode,updatenotes,mainheader,notifydomain,offerstatus,sub_medium,unsub_medium
156,23,Jazz,IDD,CallCenter,19,Balance Plus International Recharge Bonus Offer,If recharge is PKR 100 to 199.999 than incentive will be 500 MB plus Recharge amount (after tax) x 1If recharge is PKR 200 to 399.999 than incentive will be 2000 MB plus Recharge amount (after tax) x 2If recharge is PKR 400 and above than incentive will be 5000 MB plus Recharge amount (after tax) x 4,15 days for incentive,-,no,-,-,-,-,active,If recharge is PKR 100 to 199.999 than incentive will be 500 MB plus Recharge amount (after tax) x 1If recharge is PKR 200 to 399.999 than incentive will be 2000 MB plus Recharge amount (after tax) x 2If recharge is PKR 400 and above than incentive will be 5000 MB plus Recharge amount (after tax) x 4,A,If recharge is PKR 100 to 199.999 than incentive will be 500 MB plus Recharge amount (after tax) x 1If recharge is PKR 200 to 399.999 than incentive will be 2000 MB plus Recharge amount (after tax) x 2If recharge is PKR 400 and above than incentive will be 5000 MB plus Recharge amount (after tax) x 4F IF recharge is PKR 100 to 199.999 than check status through *971*2# IF recharge is PKR 200 to 399.999 than check status through *972*2# IF recharge is PKR 400 and above than check status through *973*2# (@0.06/- for status string ) Incentive validity is 15 days,Prepaid,-,"The customer will receive usual balance amount in main account (after tax) Additional balance amount will only be usable for Calling on Jazz and Warid numbers and SMS to all network on base rates (cannot be used for any other purpose) In case of multiple recharges of the same/ additional range, offer incentive will be added and validity of the latest incentive will apply Bonus amount will be a multiple of amount received after tax deductions Offer does not require any subscription, and will apply to recharge through all international vendors (Ding, TransferTo, Tranglo and Prepay Nation) Offer is applicable to any recharge from outside Pakistan from Retail, web and app channels Limited time offer All other terms and conditions remain the same as on local recharge in Pakistan",nan,-,nan,nan,nan,nan,-,nan,nan,nan,B2C,CC - RTG,Active,nan,nan
168,230,Jazz,Offer,CallCenter,19,Friends Plus Offer (re-routed to Friends bundle),"1GB Fb & 250 on-net minutes, 200 sms",2 hours,-,No,No,-,*556#,*557*4#,*557*2#,*557*3#,A,Offer (*556#) has been re-routed to the Friends bundle. Offer is available for Jazz prepaid subscribers only,Prepaid,Rs. 17,"Call Setup charges  Rs. 0.15 per call •    Offer is available for Jazz  prepaid subscribers only •    Upon dialing *556#, customer will be subscribed to Friends Bundle for 2 Hours •    All incentives will be posted at the time of subscription and will expire after 2 hours since the subscription of the bundle -•    Bundle is non-recursive and multiple subscriptions are not allowed •    Customer will be charged as per respective base rate package incase bundle incentives have exhausted and customer is not subscribed to any other bundle. For data, base rate will be charged at Rs. 5/MB. •    Limited time offer, it is subject to change anytime",nan,60 Sec,nan,nan,nan,nan,0.15,nan,Description Category Area Friends Plus Bundle - Hybrid - Hourly - Activation Prepaid Offers/Bundles Activation Friends Plus Bundle - Hybrid - Hourly - Information Prepaid Offers/Bundles Information Friends Plus Bundle - Hybrid - Hourly - Complaints - Incentive Issue Prepaid Offers/Bundles Complaints - Incentive Issue Friends Plus Bundle - Hybrid - Hourly - Complaints - General Prepaid Offers/Bundles Complaints - General,price up,B2C,"FRA - ALL,FSE groups",Active,nan,nan
176,226,Jazz,Offer,CallCenter,2,Weekly Gupshup (old name: Weekly Voice Offer),"1000 Jazz Min & SMS, 60 Other Network Min & 100MB",7 days,24 hours,No,No,24 hours,*211#,*211*4#,*211*2#,*211*3#,A,"Offer is available for subscription via whatsapp as well. Please guide customer accordingly. New CRM name is weekly gupshup offer (previously it was weekly voice offer) The Voice Sharing feature in Weekly Voice Offer, where subscribers of Weekly Voice will be able to share their Jazz minutes to other prepaid Jazz users. Shared incentive is applicable to prepaid customers only 30 On-net Mins will be transferable on each transaction by dialing the USSD *308# from party A PKR 2 (Incl. Tax) transfer fee will be applicable on Party A (Donor of the incentive) Insufficient balance will result in failure of sharing (party A) Validity of the Shared resource will be Same Day - Midnight 0 Call Setup fee will be applicable for Party B (Recipient of the incentive) Multiples sharing are allowed on same customer number (party B) Party B can check the status of his/her free incentive by dialing *308*2#",Prepaid,173 Incl Tax,"•    This change is applicable on for Prepaid Jazz Only Offer Details Offer Name Weekly Voice Offer - (Voice Sharing Dosti Offer) Incentive 1000 Jazz Min & SMS, 60 Other Network Min & 100MB Party B: 30 mins on-net Validity 7 days , Dosti bundle Validity same day till midnight Charges PKR 2 (Incl. Tax) transfer fee will be applicable on Party A for bundle sharing Time Window Weekly Offer 7 Days, Validity of the Shared resource will be Same Day - Midnight for Party B Recursive No Subscription *211# For incentive sharing Party A Dials: *308# Unsubscription *211*4# Status String *211*2# Party B Status String *308*3# Information *211*3# Party B Info String *308*3# Description • Call setup charges are PKR 0 Only on-net minutes can be shared • This change is applicable on for Prepaid Jazz Only • The revamp of Weekly Bundle with Dosti Offer for your loved ones",4632,60 Sec,nan,nan,nan,nan,0,nan,"Work Code Category Description Weekly Voice Offer - Voice - Weekly - Activation Prepaid Offers/Bundles In case customer request to activate Weekly Voice Offer Weekly Voice Offer - Voice - Weekly - Information Prepaid Offers/Bundles In case customer inquire product information (price,validity,incentive,procedure,etc) for Weekly Voice Offer Weekly Voice Offer - Voice - Weekly - Complaints - Incentive Issue Prepaid Offers/Bundles In case customer complaint for issues related to incentive (early expiry,early data blocking,less incentive posted, incentive utilization, etc) for Weekly Voice Offer Weekly Voice Offer - Voice - Weekly - Complaints - Wrong/Over Charging Prepaid Offers/Bundles In case customer complaint for issues related to charging (double deduction, wrong bundle price charged,etc) for Weekly Voice Offer Weekly Voice Offer - Voice - Weekly - Complaints - General Prepaid Offers/Bundles In case customer complaint for error on activating offer or any other issue other than incentive,wrong/over charging for Weekly Voice Offer",nan,B2C,CC - GSM JAZZ,Active,nan,nan
201,161,Jazz,Offer,CallCenter,19,Weekly WhatsApp & SMS Offer,SMS: 1500 SMS  WhatsApp (MBs): 25MBs,7 days,24 hours,No,No,24 hours,*101*1*07#,*101*4*07#,*101*2*07#,*101*3*07#,A,"This bundle was already available and customer can continue to subscribe for this bundle, only SMS quota has been increased from 1200 to 1500 SMS,25MB Whatsapp •    Overage rate is PKR 2.25/ MB",Prepaid,Rs. 34,nan,1172,60 Sec,nan,nan,nan,nan,-,nan,"Description Category Area Weekly SMS bundle - Data,SMS - Weekly - Activation Prepaid Offers/Bundles Activation Weekly SMS bundle - Data,SMS - Weekly - Information Prepaid Offers/Bundles Information Weekly SMS bundle - Data,SMS - Weekly - Complaints - Incentive Issue Prepaid Offers/Bundles Complaints - Incentive Issue Weekly SMS bundle - Data,SMS - Weekly - Complaints - Wrong/Over Charging Prepaid Offers/Bundles Complaints - Wrong/Over Charging Weekly SMS bundle - Data,SMS - Weekly - Complaints - General Prepaid Offers/Bundles Complaints - General",nan,B2C,"FRA - ALL,FSE groups",Active,nan,nan
225,31,Jazz,Offer,CallCenter,19,Monthly Super Duper Offer,"3000 Jazz+Warid On-Net, 300 Off-net Minutes, 3000 SMS All Network, 15GB",X+29 days,24 hours,No,No,24 hours,*706# or *7000#,*706*4# or *7000*4#,*706*2# or *7000*2#,*706*3# or *7000*3#,A,"Effective 14th Jan, 2025 11:59 PM, the bundle is whitelisted for resource carry forward Offer is available for subscription via whatsapp as well. Please guide customer accordingly. On New sale the offer will be charged at Rs 868 incl tax",Prepaid,NWD PKR 1304 (Incl Tax),Important Points Call setup Fee Rs.0 Data can be used for 24 hours Multiple Subscription is allowed,4010,60 Sec,nan,nan,nan,nan,nan,nan,"Proposed Work Code Description Monthly Super Duper - Hybrid - Monthly - Activation In case customer request to activate Monthly Super Duper Monthly Super Duper - Hybrid - Monthly - Information In case customer inquire product information (price,validity,incentive,procedure,etc) for Monthly Super Duper Monthly Super Duper - Hybrid - Monthly - Complaints - Incentive Issue In case customer complaint for issues related to incentive (early expiry,early data blocking,less incentive posted, incentive utilization, etc) for Monthly Super Duper Monthly Super Duper - Hybrid - Monthly - Complaints - Wrong/Over Charging In case customer complaint for issues related to charging (double deduction, wrong bundle price charged,etc) for Monthly Super Duper Monthly Super Duper - Hybrid - Monthly - Complaints - General In case customer complaint for error on activating offer or any other issue other than incentive,wrong/over charging for Monthly Super Duper",nan,B2C,CC - GSM JAZZ,Active,nan,nan
233,313,Jazz,Offer,CallCenter,15,Karachi Weekly LBC- *406# (Sindh Haftawar Offer),"20GB (10GB Whatsapp), 1000 All Network 1000 SMS",7 Days,24 Hours,No,No,24 hours,*406#,*406*4#,*406*2#,*406*3#,A,"Usage is allowed nationwide but subscription is allowed in whitelisted sites only. Offer can be subscribed multiple times, incentive would be added and latest validity would be applicable The offer can be subscribed through subscription string *406# Upon dialing *406#, customer will be subscribed to Karachi Weekly LBC for exact 7 calendar days, offer will expire on midnight of 7th calendar day (including subscription day) This bundle is non-recursive and customers will have to dial *406# again to avail the bundle again All free minutes will be posted at the time of subscription and will expire at 23:59 hrs of 7th calendar day Free Minutes / SMS / Data will be usable 24 hours a day (no time limit) Free Data MBs are for 2G/ 4G Offer is subject to change anytime handset insurance free subscription along with bundle Webdoc Handset Insurance (20K) (SH) ) product code will be shown in VAS As the previous name of this offer was Apna Shehar Weekly Offer , some cities from Punjab and Balochistan are still part of it.Please refer to the attached document for further details.",Prepaid,PKR : 347 (incl tax),nan,3994,60 Sec,nan,nan,nan,nan,NA,nan,Description Apna Shehar Weekly Offer - Hybrid - Weekly (LBC) - Activation Apna Shehar Weekly Offer - Hybrid - Weekly (LBC) - Information Apna Shehar Weekly Offer - Hybrid - Weekly (LBC) - Complaints - Incentive Issue Apna Shehar Weekly Offer - Hybrid - Weekly (LBC) - Complaints - Wrong/Over Charging Apna Shehar Weekly Offer - Hybrid - Weekly (LBC) - Complaints - General,nan,B2C,CC - GSM JAZZ,Active,nan,nan
241,296,Jazz,Offer,CallCenter,19,Weekly Super Duper Routing Weekly Super Plus,"5000 On-net Minutes, 120 Off-net Minutes, 5000 SMS, 10 GBs",X+6 Days,24 hours,No,No,24 Hours,*770#,*770*4#,*770*2#,*770*3#,A,"Dear All Please be informed that Weekly Super Duper/Weekly Gold Plus (*770# ) will now routed towards Weekly Super (*505#). ---------------------------------------------------------------------------------------------------------------------------------------------------------------- Upon dialing *770#, customer will be subscribed to Weekly Super Duper offer for 7 days Multiple subscription is allowed, Incentive will be added accordingly, Validity of latest subscription will apply. This bundle is non-recursive and customers will have to dial *770# again to avail the bundle again Multiple subscriptions are allowed •    Call setup charges are PKR 0 •    Overage rate is PKR 2.25/ MB Customer can avail this bundle from our self-service channels i.e., 3111 Self-Service IVR, *444# Dial Code",Prepaid,Rs. 345 Incl Tax,nan,3722,60 Sec,nan,nan,nan,nan,0,nan,Description Category Area Weekly Gold Plus - Hybrid - Weekly - Activation Prepaid Offers/Bundles Activation Weekly Gold Plus - Hybrid - Weekly - Information Prepaid Offers/Bundles Information Weekly Gold Plus - Hybrid - Weekly - Complaints - Incentive Issue Prepaid Offers/Bundles Complaints - Incentive Issue Weekly Gold Plus - Hybrid - Weekly - Complaints - General Prepaid Offers/Bundles Complaints - General,nan,B2C,"CC - GSM JAZZ,CC - RTG,CC - CFL,CC - QA,CE Team,FRA - ALL,Business centers,Jazz Q&T,Social Media,Comm Unit",Active,nan,nan
257,35,Jazz,Offer,CallCenter,19,Monthly Super Duper Plus,"50 GBs Data, 3,000 On-net & SMS, 500 Off-net Mins",30 Days,24 hours,No,No,24 hours,*707#,*707*4#,*707*2#,*707*3#,A,"Upon dialing *707#, customer will be subscribed to Monthly Super Duper Offer for exact 30 calendar days, offer will expire on midnight of 30th calendar day (including subscription day) Multiple subs allowed (expiry will be as per latest sub)",Prepaid,RS 1913 (inc tax),"This bundle is non-recursive and customers will have to dial *707# again to avail the bundle again Multiple Subscription is allowed All free minutes will be posted at the time of subscription and will expire at 2359 hrs of 30th calendar day. Free Minutes / SMS / Data will be usable 24 hours a day (no time limit) Offer is subject to change anytime Terms and Conditions apply Using a SIM which is not in your name or allowing others to use your SIM is a crime – PTA Overage Rate Rs. 2.25/MB Customer can avail this bundle from our self-service channels i.e.,WhatsApp 03003008000, *444# Dial Code.",3960,60 Sec,nan,nan,nan,nan,nan,nan,Monthly Super Duper Plus - Hybrid - Monthly - Activation Monthly Super Duper Plus - Hybrid - Monthly - Information Monthly Super Duper Plus - Hybrid - Monthly - Complaints - Incentive Issue Monthly Super Duper Plus - Hybrid - Monthly - Complaints - Wrong/Over Charging Monthly Super Duper Plus - Hybrid - Monthly - Complaints - General,Price updated on 27-05-25,B2C,CC - GSM JAZZ,Active,nan,nan
265,326,Jazz,Offer,CallCenter,19,Make Your Own Offer,As per Customer Selection,N\A,nan,No,No,24 hours,*303#,nan,"For 1 day *303*1#, for 7 days *303*7# and for 30 days *303*30#",nan,A,"Options Subscription Channel Status Validity Call Setup Fees Multiple Sub 1 day offer *303# , Simosa *303*1# Same day midnight 0.15 Allowed & incentive will be carried forward 7 days offer *303# , Simosa *303*7# X+6 day 0.15 Not allowed & previous incentive will be discarded 30 days offer *303# , Simosa *303*30# X+29 day 0.15 Not allowed & previous incentive will be discarded",Prepaid,As per Selection,"Important Points: Upon dialing *303#, customer will select the desired validity (1,7 & 30 days) Quota for each type of incentive i-e Jazz minutes, Other network minutes, MBs & SMS Jazz minutes can be selected Cumulative price of the bundle will be displayed to the customer after all incentive selections have been made. The respective incentives will be posted in the subscriber’s account and balance will be deducted accordingly. The created bundles are non-recursive and customers will have to dial *303# again to avail the bundle more than once With multiple subscriptions resulting in different validities, priority will be given first to daily, then weekly and lastly monthly validity for incentive consumption. Overage of Rs. 2.25/MB applies for all mobile internet bundle.",3276,60 Sec,nan,nan,nan,nan,0.15,nan,Description Category Area Make Your Own Offer - Hybrid - Default - Information Prepaid Offers/Bundles Information Make Your Own Offer - Hybrid - Default - Complaints - Incentive Issue Prepaid Offers/Bundles Complaints - Incentive Issue Make Your Own Offer - Hybrid - Default - Complaints - Wrong/Over Charging Prepaid Offers/Bundles Complaints - Wrong/Over Charging Make Your Own Offer - Hybrid - Default - Complaints - General Prepaid Offers/Bundles Complaints - General,nan,B2C,"FRA - ALL,FSE groups",Active,nan,nan
272,37,Jazz,Offer,CallCenter,19,MST Daily Hybrid Bundle,300 Jazz Minutes 300 SMS (All Network) 30 MB (3G Data),Till Midnight,24 hours,No,No,Till Midnight,*651#,nan,active,*651*2#,A,BTL offer only available on selected numbers check eligibility via Efront > Promo Tab,Prepaid,Rs. 7 (incl. tax),"Only Selective subscriber will have the option to subscribe (USSD) to a Once-off daily data bundle in which the subscriber will be charged at PKR 7 and get 30 MBs, 300 SMS and 300 Onnet Minutes per day We have the option of provisioning and de-provisioning subscribers to not only control offer validity but also to target limited subscribers. Champion Package are excluded On un-subscription, incentive will remain attached and usable till incentive expiry.",nan,60 Sec,nan,nan,nan,nan,0.15,nan,MST Daily Hybrid Bundle - Hybrid - Daily - Activation MST Daily Hybrid Bundle - Hybrid - Daily - Information MST Daily Hybrid Bundle - Hybrid - Daily - Complaints - Incentive Issue MST Daily Hybrid Bundle - Hybrid - Daily - Complaints - Wrong/Over Charging MST Daily Hybrid Bundle - Hybrid - Daily - Complaints - General,nan,B2C,CC - GSM JAZZ,Active,nan,nan
293,300,Jazz,Offer,CallCenter,15,LBC KPK (routed to Super Offer *212#),-,1 Day,24 Hours,No,No,Same day Midnight,*291#,*291*4#,*291*2#,*291*3#,A,•    Call setup charges are PKR 0.15,Prepaid,Rs 30 (incl tax),"Offer has been routed to Super Offer *212# Offer can only be subscribed in whitelisted areas, however, usage can be performed nationwide. ALOC: 16, 48, 35, 74 Multiple subscription are allowed for LBC KPK Offer (*291#).",nan,60 Sec,nan,nan,nan,nan,0.15,nan,Description Category Area LBC KPK - Hybrid - Daily (LBC) - Activation Prepaid Offers/Bundles Activation LBC KPK - Hybrid - Daily (LBC) - Information Prepaid Offers/Bundles Information LBC KPK - Hybrid - Daily (LBC) - Complaints - Incentive Issue Prepaid Offers/Bundles Complaints - Incentive Issue LBC KPK - Hybrid - Daily (LBC) - Complaints - Wrong/Over Charging Prepaid Offers/Bundles Complaints - Wrong/Over Charging LBC KPK - Hybrid - Daily (LBC) - Complaints - General Prepaid Offers/Bundles Complaints - General,nan,B2C,CC - GSM JAZZ,Active,nan,nan
301,41,Jazz,Offer,CallCenter,2,LBC Karachi,Unlimited On-net Minutes  & data @ Rs. 2.39/mb (incl tax),24 Hours,24 Hours,No,No,24 hours,*221#,*221*4#,*221*2#,*221*3#,A,Customers on any package will get unlimited Mobilink minutes at Rs.20+tax (Only within Karachi city) & data will be charged @ Rs. 2.39/mb ( incl. tax),Prepaid,Rs.20 + Tax,Offer can be used within Karachi city ALOC: 11,nan,60 Sec,nan,nan,nan,nan,0.15,nan,Description Category Area Karachi daily hybrid offer - Hybrid - Daily (LBC) - Activation Prepaid Offers/Bundles Activation Karachi daily hybrid offer - Hybrid - Daily (LBC) - Information Prepaid Offers/Bundles Information Karachi daily hybrid offer - Hybrid - Daily (LBC) - Complaints - Incentive Issue Prepaid Offers/Bundles Complaints - Incentive Issue Karachi daily hybrid offer - Hybrid - Daily (LBC) - Complaints - Wrong/Over Charging Prepaid Offers/Bundles Complaints - Wrong/Over Charging Karachi daily hybrid offer - Hybrid - Daily (LBC) - Complaints - General Prepaid Offers/Bundles Complaints - General,WCs are updated,B2C,"FRA - ALL,FSE groups,Helpdesk_Franchise",Active,nan,nan
309,301,Jazz,Offer,CallCenter,15,Karachi daily offer (routed to Super Offer *212#),-,Till midnight,Till midnight,No,No,Till midnight,*400#,*400*4#,*400*2#,*400*3#,A,"Offer has been routed to Super Offer *212# MB incentive can be used on 2G,  3G & 4G networks FUP of 1440 Minutes applies Check Offer Details for the list of Towns •    Call setup charges are PKR 0.15",Prepaid,Rs.30,nan,nan,60 Sec,nan,nan,nan,nan,PKR 0.15,nan,Description Category Area Karachi daily hybrid offer - Hybrid - Daily (LBC) - Activation Prepaid Offers/Bundles Activation Karachi daily hybrid offer - Hybrid - Daily (LBC) - Information Prepaid Offers/Bundles Information Karachi daily hybrid offer - Hybrid - Daily (LBC) - Complaints - Incentive Issue Prepaid Offers/Bundles Complaints - Incentive Issue Karachi daily hybrid offer - Hybrid - Daily (LBC) - Complaints - Wrong/Over Charging Prepaid Offers/Bundles Complaints - Wrong/Over Charging Karachi daily hybrid offer - Hybrid - Daily (LBC) - Complaints - General Prepaid Offers/Bundles Complaints - General,nan,B2C,"FRA - ALL,FSE groups",Active,nan,nan
333,200,Jazz,Offer,CallCenter,19,Monthly Premium Plus (Mahana All Rounder NWD),"25GB, 3000 On-Net, 3000 SMS, 500 Off-Net",X + 29 days,24 hours,No,-,24 hours,"*2000#, *389#","*2000*4#, *389*4#","*2000*2#, *389*2#","*2000*3#, *389*3#",A,Important Points Call Setup Fee Rs.0 Multiple subscriptions are allowed Its available nation wide Overage rate is PKR 2.25/ MB Monthly Premium  (Mahana All Rounder NWD) is renamed as Monthly Premium Plus,Prepaid,Rs 1565 (incl tax),"Customer can avail this bundle from our self-service channels i.e., *444# Dial Code. Offer is available for subscription via whatsapp as well. Please guide customer accordingly.",3036,60 Sec,nan,nan,nan,nan,0,nan,Description Category Area Monthly Premium - Data - Monthly - Activation Prepaid Offers/Bundles Activation Monthly Premium - Data - Monthly - Information Prepaid Offers/Bundles Information Monthly Premium - Data - Monthly - Complaints - Incentive Issue Prepaid Offers/Bundles Complaints - Incentive Issue Monthly Premium - Data - Monthly - Complaints - Wrong/Over Charging Prepaid Offers/Bundles Complaints - Wrong/Over Charging Monthly Premium - Data - Monthly - Complaints - General Prepaid Offers/Bundles Complaints - General,nan,B2C,CC - GSM JAZZ,Active,64,42
341,319,Jazz,Offer,CallCenter,18,SMS Plus Offer/Daily WhatsApp and SMS bundle,"1800 SMS + 10 MB for WhatsApp text messages, video/audio calls and video audio media sharing",24 Hours,24 Hours,No,No,24 hours,*106*1# Or *334#,*106*4# / *334*4#,*106*2# / *334*2#,*106*3# / *334*3#,A,"SMS Plus Offer is routed to Daily WhatsApp and SMS bundle. Auto subscription exactly after 24 hours of activation unless unsubscribed, Multiple subscriptions are allowed",Prepaid,Rs.9.6,nan,"9,294,343",60 Sec,nan,nan,nan,nan,NA,nan,"Daily Whatsapp SMS Bundle - Data,SMS - Daily - Activation Daily Whatsapp SMS Bundle - Data,SMS - Daily - Information Daily Whatsapp SMS Bundle - Data,SMS - Daily - Complaints - Incentive Issue Daily Whatsapp SMS Bundle - Data,SMS - Daily - Complaints - Wrong/Over Charging Daily Whatsapp SMS Bundle - Data,SMS - Daily - Complaints - General",nan,B2C,CC - GSM JAZZ,Active,nan,nan
